{
  "activation_allowed": false,
  "base_binding_digest": "sha256:345aa744baf91089d5e12396b161101344aa0bbb5bb0686c8954758797a29f0b",
  "decision_authority_ref": "operator",
  "decision_required": true,
  "expected_effect": "Make recurring threat-model review friction explicit.",
  "generated_at": "2026-07-24T00:10:00Z",
  "id": "generic-service-evolution-proposal",
  "kind": "concordloom.evolution-proposal",
  "operations": [
    {
      "op": "add",
      "target_id": "threat-model-review",
      "target_kind": "loop",
      "value": {
        "purpose": "Propose a bounded threat-model review child loop."
      }
    }
  ],
  "proposed_by": {
    "id": "example-orchestrator",
    "kind": "orchestrator"
  },
  "risk": {
    "failure_modes": [
      "The additional gate may delay low-risk changes."
    ],
    "level": "medium",
    "rollback": "Reject the proposal and retain the active binding."
  },
  "schema_version": "0.1",
  "signals": [
    {
      "base_binding_digest": "sha256:345aa744baf91089d5e12396b161101344aa0bbb5bb0686c8954758797a29f0b",
      "category": "friction",
      "id": "repeated-review-friction-1",
      "kind": "concordloom.evolution-signal",
      "occurrences": 1,
      "provenance": [
        {
          "kind": "evidence",
          "ref": "review-observation-1"
        }
      ],
      "schema_version": "0.1",
      "severity": "warning",
      "source_digest": "sha256:6e5d3823d41ebaa30c8e20dbb524730a56a2e7441406415b048cbdaf834e59e6",
      "summary": "Independent review repeatedly needs an explicit threat-model input."
    },
    {
      "base_binding_digest": "sha256:345aa744baf91089d5e12396b161101344aa0bbb5bb0686c8954758797a29f0b",
      "category": "friction",
      "id": "repeated-review-friction-2",
      "kind": "concordloom.evolution-signal",
      "occurrences": 1,
      "provenance": [
        {
          "kind": "evidence",
          "ref": "review-observation-2"
        }
      ],
      "schema_version": "0.1",
      "severity": "warning",
      "source_digest": "sha256:9e5c6126474367646240d46dd0c0ab61f9427d5d28b53d95960a07e43e9c7c78",
      "summary": "Independent review repeatedly needs an explicit threat-model input."
    }
  ],
  "status": "proposed"
}
